{
  "analysis_id": "analysis_1694918400000",
  "timestamp": "2023-09-16T18:40:00.000Z",
  "analysis_type": "descriptive",
  "input_files": [
    "data/processed/results_latency_test_2023-09-16T18-23-40-570Z.csv"
  ],
  "group_by": ["storage_source"],
  "metrics": ["latency_ms", "throughput_rps", "error_rate"],
  "groups": [
    {
      "group_values": {
        "storage_source": "local"
      },
      "count": 100,
      "statistics": {
        "latency_ms": {
          "mean": 42.5,
          "std": 5.2,
          "min": 32.1,
          "max": 58.7,
          "median": 41.8,
          "p50": 41.8,
          "p95": 52.3,
          "p99": 56.8,
          "ci_lower": 41.2,
          "ci_upper": 43.8,
          "ci_level": 0.95
        },
        "throughput_rps": {
          "mean": 1250.3,
          "std": 125.7,
          "min": 980.5,
          "max": 1500.2,
          "median": 1245.6,
          "p50": 1245.6,
          "p95": 1450.8,
          "p99": 1480.3,
          "ci_lower": 1220.5,
          "ci_upper": 1280.1,
          "ci_level": 0.95
        },
        "error_rate": {
          "mean": 0.012,
          "std": 0.005,
          "min": 0.001,
          "max": 0.025,
          "median": 0.011,
          "p50": 0.011,
          "p95": 0.022,
          "p99": 0.024,
          "ci_lower": 0.010,
          "ci_upper": 0.014,
          "ci_level": 0.95
        }
      }
    },
    {
      "group_values": {
        "storage_source": "s3"
      },
      "count": 95,
      "statistics": {
        "latency_ms": {
          "mean": 65.2,
          "std": 7.8,
          "min": 48.3,
          "max": 85.2,
          "median": 63.5,
          "p50": 63.5,
          "p95": 78.6,
          "p99": 83.1,
          "ci_lower": 63.8,
          "ci_upper": 66.6,
          "ci_level": 0.95
        },
        "throughput_rps": {
          "mean": 980.5,
          "std": 150.2,
          "min": 750.3,
          "max": 1200.7,
          "median": 995.2,
          "p50": 995.2,
          "p95": 1150.4,
          "p99": 1180.6,
          "ci_lower": 950.8,
          "ci_upper": 1010.2,
          "ci_level": 0.95
        },
        "error_rate": {
          "mean": 0.008,
          "std": 0.004,
          "min": 0.001,
          "max": 0.018,
          "median": 0.007,
          "p50": 0.007,
          "p95": 0.016,
          "p99": 0.017,
          "ci_lower": 0.007,
          "ci_upper": 0.009,
          "ci_level": 0.95
        }
      }
    }
  ],
  "metadata": {
    "ci_method": "bootstrap",
    "bootstrap_samples": 1000,
    "alpha": 0.05,
    "software_version": "1.0.0",
    "processing_time_ms": 1234
  },
  "warnings": [],
  "version": "1.0.0"
}
